機構名稱,地址,x,y
鍼還中醫診所,臺北市信義區忠孝東路4段500號2樓之6,121.561699963263,25.040967100089
昫安中醫診所,臺北市信義區永吉路527號2樓,121.580399646026,25.045535919119
新六福堂中醫診所,臺北市信義區忠孝東路5段197號,121.569568166411,25.041181319407
國暉中醫診所,臺北市信義區永吉路188號,121.572296389251,25.045425516186
蔡榮鏡中醫診所,臺北市信義區林口街２４巷８號１Ｆ,121.579731543481,25.037421260135
欣佑許寶童中醫診所,臺北市信義區松山路２４４號１Ｆ,121.577474191853,25.04398467537
逸安中醫診所,臺北市信義區逸仙路５０巷１２號２樓,121.562471798521,25.040466554015
進安中醫診所,臺北市信義區松信路77號,121.572259404534,25.046187778381
錦德中醫診所,臺北市信義區虎林街１０５號,121.576961358556,25.042589742002
三稜中醫診所,臺北市信義區松山路465巷8號,121.578668397738,25.039516505375
育生堂中醫診所,臺北市信義區永吉路326巷5之1號,121.575611242333,25.044964828962
大同中醫診所,臺北市信義區松山路五七六號,121.578247560473,25.037030702261
唐克鑌中醫診所,臺北市信義區和平東路三段３６１號,121.557058103296,25.020356953266
健生堂中醫診所,臺北市信義區基隆路二段１４９之１６號一樓,121.555482938708,25.026743830449
健銨中醫診所,臺北市信義區莊敬路二二六號一樓,121.561875152309,25.029849186397
成功中醫診所,臺北市信義區莊敬路432號,121.566790202505,25.027001319337
寶晟紀中醫診所,臺北市信義區忠孝東路五段472號5樓,121.577013162813,25.040667787873
聖心中醫診所,臺北市信義區富陽街50號,121.556281634416,25.02235700765
聖醫中醫診所,臺北市信義區松山路二四三號、二四五號,121.577969362,25.044429285371
大成中醫診所,臺北市信義區永吉路二OO巷五十六弄二號一樓,121.57252079047,25.043362683906
世芳中醫診所,臺北市信義區逸仙路26巷5號一樓,121.561935610647,25.039508024988
天元中醫診所,臺北市信義區松山路486號,121.577882234537,25.038663120084
陳士源中醫診所,臺北市信義區永吉路492號,121.579374097907,25.045240543675
大曜中醫診所,臺北市信義區忠孝東路五段394號2樓,121.574516061101,25.040734521399
友達牙醫診所,臺北市信義區大道路70號,121.582348184689,25.04088287643
艾來牙醫診所,臺北市信義區林口街190號,121.58091841411,25.041051068204
國泰牙醫診所,臺北市信義區光復南路449之3號,121.557802643293,25.034825394644
道明牙醫診所,臺北市信義區松山路208號,121.577611307171,25.045128987114
陳麗妃牙醫診所,臺北市信義區信義路5段7號35樓,121.564789637538,25.033416691822
雅術牙醫診所,臺北市信義區忠孝東路5段510號之1,121.578819760977,25.041151127875
敦美牙醫診所,臺北市信義區中坡南路80號,121.585324110211,25.04152906437
仁愛傑仕牙醫診所,臺北市信義區光復南路441號(含2層),121.557701935024,25.035651804312
忠孝牙醫診所,臺北市信義區忠孝東路5段451號及423巷4弄18號,121.576342388778,25.041257583863
美爵牙醫診所,臺北市信義區基隆路一段169號,121.565153850987,25.041634410839
美麗潔美學牙醫診所,臺北市信義區和平東路三段223號、223號2樓,121.553933181388,25.023286162636
維京牙醫診所,臺北市信義區松德路60號,121.576361026978,25.038719034656
一春堂中醫診所,臺北市士林區德行東路187-1號,121.531509331636,25.108920118823
歐彥君中醫診所,臺北市士林區天母西路52號,121.524733493437,25.118399546191
許秋華中醫診所,臺北市士林區文林路558號,121.524015425709,25.097739846591
崇生中醫診所,臺北市士林區文林路519號,121.523998330633,25.096973581475
百安堂仁心中醫診所,臺北市士林區忠誠路2段40巷20號,121.529222751424,25.110293141081
世康中醫診所,臺北市士林區中山北路七段39號,121.530656648941,25.119599037737
澄隆中醫診所,臺北市士林區文林路410號1、2樓,121.524993609558,25.094016770643
仁佑中醫診所,臺北市士林區社子街42號,121.507469093343,25.087439348938
畢士大中醫診所,臺北市士林區前港街108號,121.51853601758,25.085113075269
悅展中醫診所,臺北市士林區延平北路五段243號(實際使用一層),121.50971964975,25.084648278838
指筌中醫診所,臺北市士林區德行西路102號,121.520994853091,25.10397434871
源遠堂中醫診所,臺北市士林區文林路289號,121.526206188245,25.091779320602
同慶中醫診所,臺北市士林區中正路615號,121.509024246162,25.086389179176
寶安中醫診所,臺北市士林區中正路407號,121.520975567832,25.093776046881
芝音中醫診所,臺北市士林區福華路128巷10號,121.523154744745,25.102884729075
劍潭中醫診所,臺北市士林區劍潭路46號,121.522116195616,25.08361614968
承新中醫診所,臺北市士林區中正路203號(實際使用2樓),121.526827109574,25.095367399275
社子中醫診所,臺北市士林區延平北路六段87號(實際使用：1樓),121.508612212932,25.088505764141
承德中醫診所,臺北市士林區大南路277號,121.519301679344,25.088661856408
百齡中醫診所,臺北市士林區華齡街57號,121.519307013871,25.084475734976
蓉平中醫診所,臺北市士林區美崙街73號,121.521890399495,25.096973672715
士林錦禾中醫診所,臺北市士林區士東路16號(實際使用:1樓)、18號2樓,121.526907689843,25.111744330922
存德中醫診所,臺北市士林區文林路460號(實際使用：1樓),121.524559527145,25.09563947734
士林同仁中醫診所,臺北市士林區文林路402號,121.525039410504,25.093869839968
粱漢堂中醫診所,臺北市士林區社正路12之1號,121.509303181473,25.088551486423
泓景中醫診所,臺北市士林區忠誠路二段40巷6號,121.529832551031,25.110219064478
泰昌堂中醫診所,臺北市士林區中山北路六段208號2樓,121.525311295471,25.108262955478
新長庚中醫診所,臺北市士林區大東路１７６號,121.525188475227,25.093088487527
易元堂中醫診所,臺北市士林區德行東路１０９巷９１號,121.528599136136,25.110664059961
寬安中醫診所,臺北市士林區士東路５０號,121.527901017428,25.11188364784
瀚儒中醫診所,臺北市士林區德行東路25號,121.5259564005,25.106938354765
天母中醫診所,臺北市士林區忠誠路二段５０巷４號１樓,121.530150245309,25.110838161574
常甡中醫診所,臺北市士林區小北街15號,121.526326010759,25.090352223648
顏居雲中醫診所,臺北市士林區華齡街72號1樓,121.519455834219,25.084489911759
士東中醫診所,臺北市士林區中山北路六段300號1樓,121.525705252782,25.110612244216
普濟中醫診所,臺北市士林區福國路98之5號1樓,121.522071589901,25.102166936361
仰德中醫診所,臺北市士林區天母北路18號1樓,121.526295933737,25.119671793631
福華中醫診所,臺北市士林區忠誠路二段76巷8號,121.530327412908,25.1119245893
易和中醫診所,臺北市士林區士東路45號一樓,121.527591142603,25.112010167716
慶昇中醫診所,臺北市士林區中山北路七段190巷1號1樓,121.533138295763,25.125077494745
漢醫堂中醫診所,臺北市士林區小北街7號,121.526478573255,25.090316996691
惠眾中醫診所,臺北市士林區美德街70號,121.525070549398,25.095713748616
天御中醫診所,臺北市士林區德行東路215號,121.532699938455,25.109322891985
保晟中醫診所,臺北市士林區延平北路五段172號,121.510305065991,25.082904981716
天方中醫診所,臺北市士林區中山北路六段17號,121.525041776591,25.103122043017
存安堂中醫診所,臺北市士林區延平北路七段８２號,121.495308502263,25.096535712733
政德中醫診所,臺北市士林區前街17號,121.52503212533,25.09750546828
信愛中醫診所,臺北市士林區文林路478號1樓,121.524439072065,25.096077509523
柏宏中醫診所,臺北市士林區士商路78號,121.519597100588,25.091122586507
彭志綱牙醫診所,臺北市士林區天母東路77號,121.535175360613,25.118248683252
和彩牙醫診所,臺北市士林區文昌路12號,121.521835488728,25.094915954745
悅庭牙醫診所,臺北市士林區中正路172號2樓及中山北路五段609號(實際使用：1、2樓),121.509812327932,25.086423362271
英倫牙醫診所,臺北市士林區延平北路五段305號、307號,121.509317437444,25.086144262364
優德牙醫診所,臺北市士林區克強路13之1號,121.524185432386,25.108758514443
林政毅牙醫診所,臺北市士林區德行西路74號、74號2樓,121.52253766691,25.10493202954
廖宥程齒顎矯正專科診所,臺北市士林區忠誠路一段33號,121.527337497517,25.10423541191
亮顏美學牙醫診所,臺北市士林區福華路158號2樓,121.522697303958,25.103776260416
品耀牙醫診所,臺北市士林區士東路125號2樓,121.530737961276,25.112446509453
晶亮牙醫診所,臺北市士林區小北街5號及5之1號,121.526522491069,25.090307587119
慕樂牙醫診所,臺北市士林區中山北路六段152號2樓之1、152號2樓之2、154號2樓,121.525072678107,25.106662105587
人仁牙醫診所,臺北市士林區華齡街69號,121.519298097245,25.084700221328
奧森牙醫診所,臺北市士林區天母東路45之1號2樓,121.532547006247,25.11819146746
順祥牙醫診所,臺北市士林區社子街34號,121.507717435397,25.087394921015
晶綻牙醫診所,臺北市士林區中山北路六段764號(實際使用：1樓),121.528445318942,25.11600822579
博識牙醫診所,臺北市士林區中正路304號1、2樓,121.523073759078,25.094837049459
天悅牙醫診所,臺北市士林區中山北路六段268號,121.525569457443,25.109802254582
柏麗牙醫診所,臺北市士林區文林路734號2樓,121.520493852436,25.102773377323
新鼎牙醫診所,臺北市士林區天母西路11號2樓,121.528639755241,25.118496523115
格子牙醫診所,臺北市士林區天母西路40之1號3樓,121.52599088629,25.118250732663
永慶牙醫診所,臺北市士林區大東路127號(實際使用:1樓),121.525431910379,25.091706039721
亨皓牙醫診所,臺北市士林區德行西路123號,121.520411273645,25.103853923512
吳方棟牙醫診所,臺北市士林區中山北路六段405巷55號,121.526565852238,25.115781385717
芳川牙醫診所,臺北市士林區大西路19號,121.52420488621,25.090139864302
宏仁牙醫診所,臺北市士林區延平北路六段158、162號,121.509037741881,25.087056251423
賓大牙醫診所,臺北市士林區中山北路六段214號,121.525369913676,25.108413506498
戴得育牙醫診所,臺北市士林區天母西路27號2樓,121.527884362025,25.118500722512
聖林牙醫診所,臺北市士林區德行東路67號,121.527039462176,25.107318606157
達美牙醫診所,臺北市士林區忠誠路一段159號,121.530211444819,25.106943876918
天玉牙醫診所,臺北市士林區天玉街81巷4號1樓,121.530973900859,25.122855641353
美齊牙醫診所,臺北市士林區天母東路8巷75號,121.530805027859,25.115102332534
長茂牙醫診所,臺北市士林區磺溪街41號1樓,121.522931002591,25.106835698076
博格牙醫診所,臺北市士林區福國路95號1樓,121.522141133415,25.101401224021
洛杉磯牙醫診所,臺北市士林區天母東路1之1號4樓,121.530969536731,25.118357805825
倍爾牙醫診所,臺北市士林區劍潭路60號1樓,121.521664385102,25.083478020662
可潔牙醫診所,臺北市士林區通河街62號,121.520958291429,25.08067029724
合聖牙醫診所,臺北市士林區延平北路5段241號第一層,121.509732049477,25.084587964988
維育牙醫診所,臺北市士林區中正路120號、120號2樓、120之1號、120之1號2樓,121.528803701912,25.096113231192
美加牙醫診所,臺北市士林區天母東路8巷21-1號1樓,121.531998187196,25.117364090751
正齡牙醫診所,臺北市士林區中正路452號,121.51885596542,25.09289769889
永平牙醫診所,臺北市士林區延平北路六段176巷6弄1號1樓,121.506158316494,25.089932930984
國維牙醫診所,臺北市士林區忠誠路1段84號1樓、88號1樓、90號1樓,121.527669257667,25.105204580349
鄭文彥牙醫診所,臺北市士林區文林路678號2樓,121.522443625011,25.101236011433
三愛牙醫診所,臺北市士林區天母東路69巷1之1號1樓,121.534374102136,25.118568573255
中美牙醫診所,臺北市士林區忠誠路二段64號3樓,121.530452830573,25.111211181637
天泉牙醫診所,臺北市士林區中山北路六段726號3樓,121.527968865801,25.115070551312
楊恭熙牙醫診所,臺北市士林區大東路137號1樓,121.525370527716,25.09194162677
華國牙醫診所,臺北市士林區重慶北路四段４９巷４７號,121.510930000827,25.081071202316
瑞陽牙醫診所,臺北市士林區德行東路３５５號,121.538472996693,25.110536609831
新民牙醫診所,臺北市士林區華齡街１４號,121.519550185445,25.082938897952
永芳牙醫診所,臺北市士林區天母東路１－２號１樓,121.531016501862,25.118273451609
愛齒牙醫診所,臺北市士林區中正路２３４號,121.525691103616,25.09542102915
劉牙醫診所,臺北市士林區天母西路２８號２樓,121.526609504748,25.11831353807
健群牙醫診所,臺北市士林區天母西路３號４樓之６,121.528919510734,25.11882169755
慶仁牙醫診所,臺北市士林區德行東路６號,121.525291410264,25.106530569303
弘美牙醫診所,臺北市士林區延平北路六段126號１樓,121.507656993842,25.089365851113
周欽定牙醫診所,臺北市士林區延平北路五段２７７號,121.50952418972,25.085443969124
社子黃牙醫診所,臺北市士林區社子街7號,121.508434022068,25.087752045451
昭亮牙醫診所,臺北市士林區大西路２５號,121.524303364308,25.090157039745
嚴永強牙醫診所,臺北市士林區天母西路３９號４樓,121.527519580664,25.118508485016
立安牙醫診所,臺北市士林區中山北路七段１６５－３號,121.53243055613,25.124210933144
千賀牙醫診所,臺北市士林區士東路14號,121.526768399898,25.111749962757
永泰牙醫診所,臺北市士林區通河街１１９號,121.521481052416,25.080666538341
學府牙醫診所,臺北市士林區忠義街１17之1號,121.532725515006,25.107399619533
鄭文韶牙醫診所,臺北市士林區天母東路６３號２樓,121.534034049449,25.118226626801
祥瑞牙醫診所,臺北市士林區文林路487號1樓,121.524192504281,25.096243079208
以新牙醫診所,臺北市士林區中山北路七段５６－３號,121.531738057033,25.120612869614
博浩牙醫診所,臺北市士林區社正路２３號,121.509087920262,25.088619971595
先進牙醫聯合診所,臺北市士林區中山北路七段１４巷２號之１，２樓,121.531306568477,25.118670311909
揚明牙醫診所,臺北市士林區德行東路310號,121.536748705229,25.110091822821
林崇民牙醫診所,臺北市士林區天母西路６０號５樓,121.524300440763,25.118470359196
大豐牙醫診所,臺北市士林區中山北路五段６８４號２樓,121.527707321523,25.097327837778
念華牙醫診所,臺北市士林區忠誠路一段１００巷１４號地下樓,121.528207329258,25.105864878286
永信牙醫診所,臺北市士林區中山北路六段４２１號２樓,121.526887052349,25.113769935298
昇陽牙醫診所,臺北市士林區天母西路４０－１號４樓,121.52599088629,25.118250732663
芝山牙醫診所,臺北市士林區至誠路二段６６號,121.528437864452,25.101813243539
大蘋果牙醫診所,臺北市士林區天母東路４5－１號3樓,121.532547006247,25.11819146746
威廉牙醫診所,臺北市士林區天母北路８７巷２弄３號１樓,121.526992450692,25.122603569281
世安牙醫診所,臺北市士林區福港街49號１樓,121.518467208199,25.09023541807
林葉牙醫診所,臺北市士林區中山北路七段11號2樓,121.530248411579,25.119101223651
博信牙醫診所,臺北市士林區通河街173號,121.51964715865,25.081457616254
家福牙醫診所,臺北市士林區德行西路６８號,121.522626359814,25.105007335656
經緯牙醫診所,臺北市士林區德行東路２７５號１樓,121.535435425699,25.110069513792
揚信牙醫診所,臺北市士林區延平北路五段２４４巷１７號１樓,121.510520947308,25.084714083312
廣都牙醫診所,臺北市士林區華齡街４９號,121.519315136624,25.084178232599
福元牙醫診所,臺北市士林區士東路６５號,121.528088228518,25.112080874958
佳樺牙醫診所,臺北市士林區忠誠路二段１０巷４號１樓,121.529704519768,25.108674352422
吳越夫牙醫診所,臺北市士林區士東路２６６巷５弄１７－１號,121.537527789185,25.11260587832
東成牙醫診所,臺北市士林區小北街２３號１－２樓,121.526092935322,25.090410098378
育生牙醫診所,臺北市士林區中山北路五段699巷2之1號１樓,121.526887521916,25.097794160046
福國牙醫診所,臺北市士林區福國路１５巷１２號,121.52452964626,25.101409832362
邱瑋光牙醫診所,臺北市士林區天母東路1之1號3樓,121.530969536731,25.118357805825
茂林牙醫診所,臺北市士林區小北街１之３號,121.526736608013,25.090251376985
三船牙醫診所,臺北市士林區天母東路１之２號４樓,121.531016501862,25.118273451609
傅家義牙醫診所,臺北市士林區中山北路六段４７０號２樓,121.527744048863,25.114787764298
有仁牙醫診所,臺北市士林區忠誠路二段154巷13號1樓,121.532201024395,25.115235664015
佑成牙醫診所,臺北市士林區天母東路８巷２７號２樓之１,121.531858375017,25.11692510985
保齡牙醫診所,臺北市士林區忠義街８１號１樓,121.532076622384,25.106123493753
天母牙醫診所,臺北市士林區中山北路七段29號4樓,121.530566184729,25.119314609761
福臨牙醫診所,臺北市士林區志成街25號地下之2,121.530013522906,25.096979557474
哲瑞牙醫診所,臺北市士林區延平北路五段135號,121.510218295299,25.082103914098
許牙醫診所,臺北市士林區忠誠路一段57號1樓,121.527851954177,25.103980824623
立宸牙醫診所,臺北市士林區忠誠路2段42號1樓,121.529927686136,25.110372290799
聯有牙醫診所,臺北市士林區中山北路六段150號2樓,121.525028192002,25.106393544402
旺德牙醫診所,臺北市士林區天母東路8巷37號,121.53168592176,25.116532261509
宗賢牙醫診所,臺北市士林區承德路四段236號1樓,121.521143632862,25.08884460792
京東牙醫診所,臺北市士林區士東路200巷70號,121.533913974857,25.110260263224
劭陽牙醫診所,臺北市士林區忠義街117號1樓,121.532754009259,25.107502093313
國聯牙醫診所,臺北市士林區天母北路32號1樓,121.526377088688,25.120232089596
維美牙醫診所,臺北市士林區文林路428號,121.524860054356,25.094511374038
大偉牙醫診所,臺北市士林區天玉街38巷10號,121.529336808226,25.120620750252
忠誠牙醫診所,臺北市士林區忠誠路二段1號１樓,121.530797217889,25.108689900563
大雅牙醫診所,臺北市士林區忠誠路一段１８６號１樓,121.529913274429,25.107801835604
賴牙醫診所,臺北市士林區中山北路六段１６１號２樓之３,121.524825120092,25.106955787296
嘉民牙醫診所,臺北市士林區中山北路六段168號2樓,121.525130907181,25.107107160785
弘佑牙醫診所,臺北市士林區天玉街38巷12之1號,121.529361866464,25.120482586724
第一牙醫診所,臺北市士林區德行東路４６巷４弄３號１樓,121.526079645853,25.106636959949
光華牙醫診所,臺北市士林區延平北路五段１８６號２樓,121.510244360121,25.083211810141
親親牙醫診所,臺北市士林區中山北路五段６２２號２樓,121.527920008651,25.096647036543
陳慶成牙醫診所,臺北市士林區中正路２４０號(含地下室),121.52521801847,25.095322204889
長虹牙醫診所,臺北市士林區福港街１２１號,121.518135929763,25.088242110592
宏誠牙醫診所,臺北市士林區中山北路六段４５０巷７弄１號,121.528002798128,25.1139373176
凱健牙醫診所,臺北市士林區天母東路８巷２７號之６一樓,121.532340568242,25.116936027442
喬森牙醫診所,臺北市士林區後港街１８號,121.522854073592,25.082873857429
信誼牙醫診所,臺北市士林區天母北路１２－１號２樓,121.526007526743,25.119318928978
光和牙醫診所,臺北市士林區基河路２３８之３號１樓,121.52142541471,25.091196467595
信美牙醫診所,臺北市士林區延平北路五段１６３巷７號,121.509734396091,25.082626892793
端容牙醫診所,臺北市士林區中正路３２０號,121.5226294739,25.094734693708
劉定國牙醫診所,臺北市士林區天母東路４３巷４弄２號,121.532486211015,25.118473034046
士東牙醫診所,臺北市士林區中山北路六段４３３號,121.527224647185,25.114408630699
蘇鴻輝牙醫診所,臺北市士林區延平北路六段７６號,121.508801008113,25.08867310171
德行牙醫診所,臺北市士林區德行東路187號,121.531540851645,25.108931372096
雅鄰牙醫診所,臺北市士林區延平北路五段１2５號,121.51025959502,25.081874649169
橙光耳鼻喉科診所,臺北市士林區大南路286號,121.519314288175,25.088809501914
佩佩婦幼診所,臺北市士林區中山北路六段182號、182號2樓,121.525200934896,25.10758680558
昕新診所,臺北市士林區基河路250號,121.520843300624,25.091700642315
優儷芙生活診所,臺北市士林區中正路300號(實際使用:2、3樓),121.523213309459,25.094873788923
士林大學眼科診所,臺北市士林區文林路496號(含夾層)、498號(含夾層)、500號及500號2樓,121.52435216177,25.096505158166
心福內科診所,臺北市士林區中山北路六段167號(實際使用:1、2樓),121.524861002442,25.107169281042
朝陽復健科診所,臺北市士林區中山北路五段699巷2號,121.526988443803,25.097817888294
宸安力康診所,臺北市士林區德行東路153號,121.529723321532,25.10829519042
廖正義診所,臺北市士林區通河街９０號,121.520013167384,25.081085705943
林博通醫師診所,臺北市士林區通河街６０號,121.521004946985,25.080650289821
蘇慧卿診所,臺北市士林區大南路２７４號,121.519681860465,25.088748503542
洪楷義耳鼻喉科診所,臺北市士林區忠誠路二段８８號１樓,121.530932064747,25.112677156951
張松柏眼科診所,臺北市士林區忠誠路二段58號2樓,121.530442948931,25.111115637569
梁如蘭眼科診所,臺北市士林區中山北路六段２６６號１樓,121.525557790116,25.109731092062
吳俊昇眼科診所,臺北市士林區中山北路六段４３4號１樓,121.527297473955,25.113929075321
王文豪診所,臺北市士林區美崙街６6號1樓,121.522192797191,25.097136765065
安寧診所,臺北市士林區劍潭路91號,121.519909238148,25.082845897523
忠誠聯合診所,臺北市士林區忠誠路2段50巷35號,121.529145497717,25.110794777743
華齡診所,臺北市士林區華齡街７４號１樓,121.519454644987,25.084527580907
慈田耳鼻喉科診所,臺北市士林區延平北路五段１８５號１樓,121.509998999552,25.083222286486
天母英明診所,臺北市士林區天母東路６９巷７號１Ｆ,121.534200192812,25.118942624591
何小兒科診所,臺北市士林區福港街１７６號,121.517681950154,25.086653514486
政吉內科診所,臺北市士林區士東路６7號,121.528131992175,25.112086894239
蕭雨青小兒科診所,臺北市士林區延平北路五段２９２號１樓,121.509701562087,25.085702528167
葉耳鼻喉科診所,臺北市士林區延平北路五段218號,121.510090985081,25.083982908588
立安復健科診所,臺北市士林區大東路130號,121.52554341191,25.091759190021
保安眼科診所,臺北市士林區大東路44號,121.525390236148,25.08954087803
鄭福山婦產科診所,臺北市士林區中山北路六段256號,121.525507530577,25.109469403876
韓偉骨科診所,臺北市士林區基河路250號,121.520843300624,25.091700642315
杏昌診所,臺北市士林區文林路736號1樓,121.520407288078,25.102839549498
柏齡診所,臺北市士林區福港街105號,121.518286132936,25.088567064804
迦美診所,臺北市士林區中山北路七段14巷2-2號3樓,121.530990736839,25.118516017625
平安診所,臺北市士林區社子街36之1號1樓,121.507616158742,25.087426450393
林志聰皮膚科診所,臺北市士林區文昌路26號,121.521713763174,25.095220203029
天晴診所,臺北市士林區中山北路六段292號、292號2樓,121.525671914667,25.110400727946
永安診所,臺北市士林區中山北路六段405巷63號、63號地下1層及63之1號,121.526465852778,25.116071331879
佳視得眼科診所,臺北市士林區天母北路11-1號1樓,121.526554348461,25.119280180605
東杏診所,臺北市士林區中山北路六段431之2號2樓,121.527076842027,25.114179691591
周怡宏小兒科診所,臺北市士林區基河路200號,121.52176190841,25.090267103727
淨美皮膚科診所,臺北市士林區文林路317號(實際使用:1、2樓),121.525944990082,25.092216616389
健群骨科診所,臺北市士林區延平北路六段8號及10號1、2、3樓,121.509270544373,25.08712115873
天母芝美時尚診所,臺北市士林區福華路159號1樓,121.522048937066,25.10380936568
天母麥茵茲美形診所,臺北市士林區天玉街38巷20號4樓,121.529912018057,25.11914562541
博政骨科診所,臺北市士林區德行西路99號、101號,121.521217904535,25.104319193539
葉眼科診所,臺北市士林區延平北路5段173號(實際使用1、2層）,121.51006621907,25.082879576347
立全復健科診所,臺北市士林區中山北路六段330號(實際使用:1樓),121.525895700242,25.111240432497
