機構名稱,地址,x,y
久恆牙醫診所,臺北市松山區民生東路5段93號,121.559610175128,25.058798628452
康和牙醫診所,臺北市松山區八德路3段241號1、2樓,121.557413261272,25.048278885055
博美牙醫診所,臺北市松山區八德路4段106巷2弄20號1樓,121.560215756919,25.047956008464
松展牙醫診所,臺北市松山區三民路8號,121.563974060876,25.052293844377
胡廣煜牙醫診所,臺北市松山區民生東路三段118號6樓之3,121.545328272308,25.057464699566
品睿牙醫診所,臺北市松山區民生東路三段113巷25弄6號2樓,121.546585509494,25.05948486089
大友牙醫診所,臺北市松山區撫遠街350號之1,121.565990639512,25.062572718546
崇皓牙醫診所,臺北市松山區光復北路202號,121.555602197198,25.055015770917
采德牙醫診所,臺北市松山區南京東路五段106號2樓,121.561982645296,25.051249228507
森之谷美學牙醫診所,臺北市松山區南京東路五段40、42號,121.558091187887,25.051319892479
得意牙醫診所,臺北市松山區民權東路三段160巷22號2樓之2,121.546908624904,25.06002858598
佳禾牙醫診所,臺北市松山區八德路四段6號,121.558161372663,25.048121588061
恩信牙醫診所,臺北市松山區南京東路五段200號6樓之4,121.564272800607,25.051200506884
雅客牙醫診所,臺北市松山區南京東路五段3號4樓,121.557536778928,25.051750463511
維一牙醫診所,臺北市松山區民生東路五段188號,121.56389460066,25.058612956621
泰華牙醫診所,臺北市松山區光復北路38號,121.557683531825,25.049407667565
澄品牙醫診所,臺北市松山區敦化北路145巷73號,121.55210489503,25.053513689898
誠楷牙醫診所,臺北市松山區敦化南路一段7號3樓,121.549298332174,25.046914991748
薏安牙醫診所,臺北市松山區南京東路四段197號2樓之2、2樓之3,121.556960386941,25.051758385797
美學牙醫診所,臺北市松山區民生東路四段97巷1弄4號,121.551828408666,25.058512949638
康河牙醫診所,臺北市松山區南京東路四段77號2樓,121.553875025817,25.051830744771
佳誠美學牙醫診所,臺北市松山區南京東路五段232號,121.565803397375,25.050944003029
魔法兔齒顎矯正牙醫診所,臺北市松山區東興路2巷5號,121.56496398421,25.050677927829
新尊榮牙醫診所,臺北市松山區八德路四段674號,121.576328467711,25.049869649388
博飛迅牙醫診所,臺北市松山區八德路四段666號7樓之2,121.576114595694,25.049862814231
康士美牙醫診所,臺北市松山區復興北路73號2樓、2樓之1、2樓之2,121.544240577452,25.051045969603
喜樂芽牙醫診所,臺北市松山區八德路四段245巷33號,121.564374572384,25.050535792058
原邑診所,臺北市松山區健康路325巷6弄21號,121.568194995701,25.055148806949
妍棠美學診所,臺北市松山區敦化北路145巷49號,121.551316200265,25.053687141274
麗生時尚美學診所,臺北市松山區南京東路四段56號2樓,121.553846855318,25.051437217912
傑尼斯時尚醫美整形外科診所,臺北市松山區南京東路五段230號3樓之7、3樓之8,121.565682025402,25.051175899014
長泰牙醫診所,臺北市松山區長春路５００號２樓,121.547465168443,25.054368549811
大統牙醫診所,臺北市松山區八德路三段２２５號２樓－４,121.556998078111,25.048233975014
政雄牙醫診所,臺北市松山區民生東路五段２４３號,121.567825127322,25.059340769746
新中牙醫診所,臺北市松山區新中街１２之１號,121.56057270776,25.059893863168
哲伸牙醫診所,臺北市松山區八德路三段１０６巷５０號,121.554202247872,25.046667908139
明義牙醫診所,臺北市松山區長安東路二段２１５號５樓－２,121.544424172288,25.048368811335
國峰牙醫診所,臺北市松山區撫遠街３７０號,121.565756856694,25.063516270376
正信牙醫診所,臺北市松山區民生東路五段１６５號２樓－１,121.56413596337,25.059200351428
新華南牙醫診所,臺北市松山區延吉街２６號,121.553465410272,25.046386424888
李玉閣牙醫診所,臺北市松山區南京東路五段１６３－３號３樓,121.562637176623,25.051883227441
宏慈牙醫診所,臺北市松山區光復南路21之4號,121.558055766393,25.046978627646
正斌牙醫診所,臺北市松山區南京東路四段７５巷１８號,121.553641877056,25.052426769928
偉德牙醫診所,臺北市松山區南京東路四段１０６號２樓,121.554433159394,25.051427645681
惠民牙醫診所,臺北市松山區八德路三段１４７－２號,121.55500775803,25.048202044093
施牙醫診所,臺北市松山區三民路１４３號,121.563104631912,25.060703432968
光泰牙醫診所,臺北市松山區南京東路四段１７２號,121.556849164663,25.051369197534
得揚牙醫診所,臺北市松山區三民路１３６巷４２號,121.5639289001,25.0602644951
吉聖牙醫診所,臺北市松山區八德路四段７號,121.55829731929,25.048402833525
竹君牙醫診所,臺北市松山區南京東路五段５４號２樓,121.560194126674,25.05129132924
元榜牙醫診所,臺北市松山區民生東路四段８８號,121.553331847975,25.057958441621
王樣牙醫診所,臺北市松山區敦化北路４巷３５號,121.54519693382,25.050097044327
周牙醫診所,臺北市松山區南京東路五段２５６號,121.566429522043,25.0511508866
健本牙醫診所,臺北市松山區八德路四段２１０－２號,121.564505931126,25.048733819878
西松牙醫診所,臺北市松山區南京東路五段２９１巷４號,121.566074112235,25.051791092358
一泰牙醫診所,臺北市松山區民權東路五段５０號,121.565088070985,25.062907791485
怡德牙醫診所,臺北市松山區南京東路五段２59號,121.56528401241,25.051582086949
丘牙醫診所,臺北市松山區民生東路五段２２２號,121.565505006416,25.058900704327
固榮牙醫診所,臺北市松山區延吉街１６號,121.553414625805,25.046959525354
西華牙醫診所,臺北市松山區民生東路三段１１３巷６弄５號,121.545835500962,25.058584128729
麟翔牙醫診所,臺北市松山區慶城街２４號２樓,121.545739044599,25.053691948175
生春牙醫診所,臺北市松山區南京東路五段139號,121.561544092562,25.051691906848
崇民牙醫診所,臺北市松山區南京東路三段２５９號３樓,121.544919102593,25.052025608114
雅安牙醫診所,臺北市松山區民權東路三段117號,121.545523129753,25.062291776533
向虹牙醫診所,臺北市松山區民族東路７６１號,121.549947166754,25.062351798769
景仲牙醫診所,臺北市松山區復興北路２１５號,121.544452418536,25.056450560148
王誌牙醫診所,臺北市松山區民權東路三段１６０巷２４號,121.54686354086,25.05998458682
立達牙醫診所,臺北市松山區敦化北路２２２巷６２號,121.546787979065,25.060199606122
同心牙醫診所,臺北市松山區八德路三段１２巷７弄２號,121.550799851902,25.047064281427
仁惠牙醫診所,臺北市松山區八德路三段74巷64號,121.552391706527,25.046454583533
慶華牙醫診所,臺北市松山區延吉街１０巷８號,121.553203445777,25.047295126303
宏國牙醫診所,臺北市松山區民生東路五段１５號,121.555890956628,25.058454770666
史丹佛牙醫診所,臺北市松山區南京東路四段１０７號２樓,121.554667932956,25.051821610801
李國師牙醫診所,臺北市松山區八德路三段８１號２樓－２,121.553198765317,25.048310420494
延齡牙醫診所,臺北市松山區延壽街１２５號,121.564641990686,25.057064473055
凱悅牙醫診所,臺北市松山區民權東路三段１６０巷２－６號,121.54777316734,25.061520055094
揚登牙醫診所,臺北市松山區南京東路五段２５０巷９－３號１樓,121.566011663208,25.050018828884
上傑牙醫診所,臺北市松山區八德路二段３８６號２樓－３,121.546324241879,25.048003123752
小林牙醫診所,臺北市松山區南京東路五段２９１巷３２號,121.56610167137,25.052750748656
立人牙醫診所,臺北市松山區民權東路三段１０３巷１號,121.545118536119,25.062439038184
高登牙醫診所,臺北市松山區民權東路三段１６６號１樓,121.548471494858,25.061689524797
林翰牙醫診所,臺北市松山區新東街３０巷42號,121.567644618951,25.059697182052
蔡嘉倫牙醫診所,臺北市松山區民生東路三段１１６號３樓,121.545075532401,25.057562317806
峰牙醫診所,臺北市松山區民生東路四段49號、53號地下1樓,121.55027079585,25.057954593981
嵩峰牙醫診所,臺北市松山區撫遠街３６７巷１０號,121.566319066791,25.063826875876
明君牙醫診所,臺北市松山區八德路四段８０５號,121.578788380227,25.051373226834
元品牙醫診所,臺北市松山區饒河街１９８號,121.576900151658,25.050721644004
暘昇牙醫診所,臺北市松山區南京東路三段２６０－１號２樓,121.544909284804,25.051631912552
啟瑞牙醫診所,臺北市松山區三民路１１０巷１０號１樓,121.564705583168,25.057994994039
台新牙醫診所,臺北市松山區民生東路五段１４６號２樓,121.562083880655,25.058556552638
毛冠人牙醫診所,臺北市松山區南京東路五段２３巷１８號,121.558107785443,25.053245322006
祐腎內科診所,臺北市松山區南京東路四段50號8樓,121.553461521987,25.051447131529
介壽診所,臺北市松山區光復北路226號,121.555457252321,25.055946652725
聯安診所,臺北市松山區南京東路4段16號地下二樓,121.553036892129,25.051324405921
怡碩視光眼科診所,臺北市松山區復興北路313巷28號,121.546058344544,25.058852083478
裕昇診所,臺北市松山區民生東路5段95號,121.559690327321,25.058805079363
英田耳鼻喉科診所,臺北市松山區復興北路331號2樓,121.544417819722,25.059683306317
永承診所,臺北市松山區敦化北路155巷9號地下一層,121.550415271585,25.054215535894
松山信合美眼科診所,臺北市松山區三民路      9號1樓、9之1號1樓、9之2號1樓、9之3號1樓、9之4號1樓、9之5號1樓,121.563565101112,25.053775949411
李士虹皮膚科診所,臺北市松山區民權東路3段136號3樓之1,121.546400744178,25.061870018764
富樂診所,臺北市松山區敦化北路167號1樓A區,121.5494339495,25.054708877728
光一診所,臺北市松山區延吉街22巷1號1樓,121.553245560851,25.046580922635
康健診所,臺北市松山區延吉街11號2樓;40號,121.553611691596,25.046665677285
景賀時尚診所,臺北市松山區光復北路125號,121.55722190365,25.052311329619
泛亞皮膚科整形外科診所,臺北市松山區復興北路35號4樓,121.544219052605,25.050083251198
哈佛診所,臺北市松山區復興北路369號13樓,121.544773088285,25.062448277709
聯欣診所,臺北市松山區南京東路4段16號5樓,121.553036892129,25.051324405921
?眼明眼科診所,臺北市松山區南京東路三段309號2樓,121.546937468634,25.051996477314
松原復健診所,臺北市松山區光復北路206號,121.555504563393,25.055191532915
安德醫美診所,臺北市松山區八德路三段36號12樓,121.552196429332,25.048079808594
佳德診所,臺北市松山區健康路18號、18之1號1樓及地下1層,121.552712588556,25.052821578646
安德復復健專科診所,臺北市松山區光復北路181號地下二層,121.555371603122,25.058414525776
周適偉診所,臺北市松山區復興北路69號7樓,121.544234428662,25.05085872313
景賀診所,臺北市松山區民生東路5段85號,121.559288609716,25.058769487601
弘光耳鼻喉科診所,臺北市松山區民生東路四段117號,121.553281347,25.058238047622
蘋果樹醫美診所,臺北市松山區南京東路三段309號3樓,121.546937468634,25.051996477314
何兆芬健康診所,臺北市松山區南京東路四段47號2樓,121.550865623395,25.051895887666
金贊診所,臺北市松山區南京東路四段66號2樓、寧安街68巷25號2樓,121.550605045869,25.051901611609
生昇復健專科診所,臺北市松山區三民路39號,121.563506692914,25.055938403239
美人魚時尚婦產科診所,臺北市松山區南京東路三段331號9樓,121.547286312367,25.051988638023
聯青診所,臺北市松山區南京東四段16號地下一層,121.553047199071,25.051332095556
安綺整形外科診所,臺北市松山區南京東路四段17號3樓,121.550126108398,25.051910364889
立悅皮膚科診所,臺北市松山區南京東路五段46號4樓,121.559786745181,25.051301658387
嘉美媞時尚醫美診所,臺北市松山區復興北路69號10樓,121.544234428662,25.05085872313
鈞賀診所,臺北市松山區富錦街462號,121.562333270439,25.060737421426
美仕媞時尚醫美診所,臺北市松山區民權東路三段178號15樓,121.54954863312,25.06146110533
新心診所,臺北市松山區光復北路11巷63號,121.560247107897,25.050159374035
李政洋身心診所,臺北市松山區三民路84號,121.563836507665,25.056502577141
史丹佛健康美學診所,臺北市松山區復興北路145號3樓,121.544293187647,25.053636810852
松山大愛眼科診所,臺北市松山區南京東路五段269號1、2、3樓,121.565518342124,25.051577980998
臻品絕色診所,臺北市松山區興安街157號,121.545446817035,25.056163051452
極光美學診所,臺北市松山區南京東路四段25號2樓,121.550605045869,25.051901611609
尚志塾遠絡診所,臺北市松山區南京東路四段164號3樓之1 ,121.556691155034,25.051375035101
?悅診所,臺北市松山區南京東路五段324號,121.568290187556,25.051094314982
延壽耳鼻喉科診所,臺北市松山區延壽街113號,121.565248199031,25.057104002922
麥茵茲美形診所,臺北市松山區南京東路三段337號10樓D室、E室,121.5479946396,25.051963095209
髮王植髮診所,臺北市松山區慶城街21之3號3樓,121.545108571868,25.053420605029
達特邱診所,臺北市松山區八德路二段350號2樓,121.545418458225,25.04781737748
澄東耳鼻喉科診所,臺北市松山區三民路37號,121.563523803958,25.055800687898
恩緹悠活時尚診所,臺北市松山區慶城街24號4樓,121.545739044599,25.053691948175
W頂尖醫美診所,臺北市松山區南京東路三段270號4樓,121.545207968692,25.051626130965
悠適復健科診所,臺北市松山區光復北路11巷65號,121.560309056623,25.05015884245
台北法喬醫美診所,臺北市松山區復興北路311號3樓,121.544406325822,25.058836120358
欣悅超美診所,臺北市松山區復興北路73號3樓,121.544240577452,25.051045969603
聖光眼科診所,臺北市松山區南京東路四段181、183號,121.550928368449,25.051423632368
南京帛瑿診所,臺北市松山區南京東路五段166、168號11樓,121.558091187887,25.051319892479
康活診所,臺北市松山區復興北路333號5樓,121.544420922738,25.059804604809
佳利安診所,臺北市松山區南京東路三段305號8樓,121.546806147718,25.051982317303
駿昂耳鼻喉科診所,臺北市松山區八德路二段395號,121.546400966085,25.04832455645
瑞麗嘉健康美學診所,臺北市松山區三民路18號2樓之2,121.563963633342,25.05276138278
髮立現健康醫學診所,臺北市松山區民生東路三段113巷6弄3號,121.545934616136,25.058575693325
樂康診所,臺北市松山區八德路三段 221之1號,121.556922815502,25.048226800026
佑家診所,臺北市松山區八德路三段233號,121.557149658455,25.048249341087
安兒康小兒專科診所,臺北市松山區敦化北路116號、118號、118號2樓,121.548570791766,25.05379129753
南京光澤診所,臺北市松山區南京東路五段154號2樓、156號2樓,121.562664685046,25.051222406212
榮恩耳鼻喉科小兒科聯合診所,臺北市松山區南京東路五段２５８號,121.566471444895,25.051151042709
林聰賢婦產科診所,臺北市松山區八德路四段３４５號２Ｆ,121.56786983831,25.049358621649
劉內兒科診所,臺北市松山區民生東路五段148號、148之1號,121.56215116836,25.058493571185
趙耳鼻喉科診所,臺北市松山區八德路四段６４９號一樓,121.575369755672,25.050174441657
謝耳鼻喉科診所,臺北市松山區民生東路五段１４８號２樓,121.56215116836,25.058493571185
康明哲小兒科內科診所,臺北市松山區三民路１３６巷１５號,121.564080434197,25.060664691732
佳祐內兒科診所,臺北市松山區八德路四段９１巷１號,121.560768265301,25.048884652035
松山內兒科診所,臺北市松山區八德路四段２５５號,121.565108667886,25.049043257358
王俊彰耳鼻喉科診所,臺北市松山區民生東路五段１７號,121.55594371918,25.058460242763
林志聖眼科診所,臺北市松山區三民路１４０號,121.563406717087,25.060682687302
陳泰安耳鼻喉科診所,臺北市松山區光復北路９７號,121.558050934631,25.050861076011
張芳杰內兒科診所,臺北市松山區民生東路五段１３８巷７號,121.561703259014,25.05816756651
高國隆婦產科診所,臺北市松山區八德路四段257號2樓,121.565147279403,25.049047624486
陳大昕耳鼻喉科診所,臺北市松山區八德路四段１００號,121.560761869914,25.04836980681
吳耳鼻喉科診所,臺北市松山區三民路１１３巷１－１號,121.563328931769,25.057916442251
陳炳堅內科診所,臺北市松山區延壽街３２７號,121.560362764192,25.056785879442
新象整形外科診所,臺北市松山區南京東路三段２７８號７樓,121.54561289636,25.051618288366
康瑞耳鼻喉科診所,臺北市松山區八德路三段154號1樓,121.554962519739,25.047980339728
朱家庭醫學科診所,臺北市松山區八德路三段１２巷５７弄３９之1號,121.552137940256,25.045511237382
吳慶南內科診所,臺北市松山區民生東路五段１３８巷１號,121.561698597422,25.058532108977
華南小兒科診所,臺北市松山區延吉街３０巷１５號,121.552616718274,25.046073900299
江建中診所,臺北市松山區八德路4段285號1樓,121.56597751744,25.049139492672
尚群眼科診所,臺北市松山區南京東路五段４３號１樓,121.558546444722,25.051770260531
民生翁耳鼻喉科診所,臺北市松山區民生東路五段78號1樓,121.559048540574,25.058363642487
江崇萍小兒科診所,臺北市松山區南京東路五段２５１巷２４弄２７號,121.564351079684,25.052357360073
馮子強診所,臺北市松山區民權東路三段160巷7號,121.548001491892,25.061043795989
安德聯合診所,臺北市松山區八德路三段３４號４樓及１２樓,121.552021154773,25.04808013501
安成診所,臺北市松山區富錦街４９７號,121.564000210365,25.061112732385
美佳皮膚科診所,臺北市松山區八德路三段１６４號２樓,121.555299779339,25.047946858298
傅眼科診所,臺北市松山區八德路三段156號3樓,121.555004326937,25.047977050805
傳芳婦產科診所,臺北市松山區八德路四段６５９號６６１號一樓二樓,121.575619544989,25.050179333095
王貞乃皮膚科診所,臺北市松山區民生東路四段80巷6弄7號,121.552498479537,25.056861522567
王躬仁診所,臺北市松山區新中街１２之３號１樓,121.560505932473,25.060189656839
車參薇小兒科診所,臺北市松山區八德路三段195號１樓,121.556189955208,25.048162512463
洪小兒科診所,臺北市松山區市民大道五段１６５號１樓,121.564650641037,25.048086257298
方一強眼科診所,臺北市松山區民生東路四段１０１號２樓,121.552367669176,25.058154283068
趙彥宇邱慧嫻皮膚科聯合診所,臺北市松山區慶城街8之1號3樓及8號3樓,121.544944459666,25.052762050924
京華皮膚科診所,臺北市松山區八德路三段238號,121.557405779505,25.048044499857
英爵聯合診所,臺北市松山區南京東路三段331號2樓,121.547286312367,25.051988638023
閎新耳鼻喉科皮膚科聯合診所,臺北市松山區八德路三段20之2號,121.551219404256,25.048072170158
完全優整合醫學診所,臺北市松山區南京東路三段303巷6弄11號,121.547327630267,25.052504177205
日聖眼科診所,臺北市松山區新中街３５號,121.560348046823,25.059283711947
安美診所,臺北市松山區八德路二段400號3樓,121.546570356956,25.048043187755
正風復健科診所,臺北市松山區光復北路133及135號1樓,121.557098715416,25.052778956832
大家好診所,臺北市松山區民生東路四段８０巷１１弄２號１樓,121.553088986727,25.056581351185
湘豐整形外科診所,臺北市松山區敦化北路１４１號５樓,121.549341261849,25.053637112687
蔡恭禮內兒科診所,臺北市松山區新東街28號之2,121.566036701659,25.059240272126
杏友診所,臺北市松山區八德路三段155巷2號,121.55514991839,25.048407803844
林忠志診所,臺北市松山區南京東路五段291巷20弄3之3號,121.565807143755,25.052483377158
王世興醫師診所,臺北市松山區八德路四段10號,121.558284495376,25.048135904308
詹前俊小兒科診所,臺北市松山區民生東路五段１０５號,121.560077041566,25.058775724784
周玄文診所,臺北市松山區民權東路三段１６０巷１９弄６號,121.547637920556,25.060268210971
余內科診所,臺北市松山區八德路四段６４６號,121.574931370728,25.049845036124
雷湘安皮膚科診所,臺北市松山區三民路43巷1號,121.56346923498,25.055976535319
張國華整形外科診所,臺北市松山區南京東路五段34號2樓,121.559342972611,25.051312222766
林永濤整形外科診所,臺北市松山區光復北路７號７樓,121.558018277495,25.048964848712
安禾聯合診所,臺北市松山區民權東路三段一七八號三樓,121.54954863312,25.06146110533
親親家庭診所,臺北市松山區南京東路五段347號,121.567755619366,25.051546821996
黎博彥診所,臺北市松山區民生東路五段230號,121.565830865086,25.058927702773
美麗優品時尚診所,臺北市松山區民生東路四段97巷2弄1號,121.552221630705,25.058528875974
宇恩復健科診所,臺北市松山區民權東路三段140巷15號3樓,121.546741789803,25.060500671866
正顏診所,臺北市松山區八德路二段410巷12號,121.54665769073,25.047308560166
奧斯卡眼科診所,臺北市松山區敦化南路一段7號3樓之1,121.549298332174,25.046914991748
邱楠超診所,臺北市松山區延吉街20號1樓,121.553414801983,25.046813324397
信恩美醫診所,臺北市大安區信義路二段７２號４樓,121.526375379356,25.034228818056
張少萌婦產科診所,臺北市大安區信義路四段１９９巷２號４樓之１之２,121.551526844544,25.033562968164
劉耳鼻喉科診所,臺北市大安區復興南路2段151巷27號、27之1號,121.544662587889,25.028469722692
曹眼科診所,臺北市大安區和平東路二段２６９號２樓,121.544146821011,25.024977805291
忠孝眼科診所,臺北市大安區忠孝東路四段１１２號６樓－７,121.546847488755,25.041356968635
董曉青眼科診所,臺北市大安區安和路二段69巷6號2樓,121.552677775108,25.030401801273
大安黃耳鼻喉科診所,臺北市大安區和平東路3段234號,121.55479169166,25.021990744794
黃禎祥診所,臺北市大安區師大路７１號,121.528590344041,25.02368093943
陳秀鳳婦產科診所,臺北市大安區和平東路二段１９１號２樓,121.542116981003,25.025253997029
大安林內科診所,臺北市大安區敦化南路一段３２１號５樓,121.549168932744,25.034613557646
新鑫耳鼻喉科診所,臺北市大安區師大路１０５巷１３號１樓,121.529074331497,25.022607707954
陳志明診所,臺北市大安區和平東路二段３３７號,121.545721575311,25.024890842914
蔡國仁內兒科診所,臺北市大安區忠孝東路三段２１７巷４弄２１號,121.540613813916,25.042908449899
詹骨科診所,臺北市大安區信義路四段５３巷６號,121.545003734454,25.033661198667
詹內科診所,臺北市大安區和平東路一段７７－２號,121.525170520456,25.027056517366
吳坤光婦產科診所,臺北市大安區信義路四段５９號,121.545439763699,25.03353139128
楊懷卿耳鼻喉科診所,臺北市大安區光復南路３０８巷５５號,121.555300843919,25.038861912516
劉達昌眼科診所,臺北市大安區和平東路三段２３８號,121.554876393901,25.021906070275
林青穀家庭醫學科診所,臺北市大安區大安路1段2之1號,121.546007746294,25.044846668705
博全婦產科診所,臺北市大安區大安路一段18號、16巷1、1-1、3、3-1、5、5-1號2樓,121.545317082697,25.036516126136
鄭耳鼻喉科診所,臺北市大安區信義路四段３４１號,121.556702082308,25.033300058809
施崇仁耳鼻喉科診所,臺北市大安區和平東路二段３１１巷13號１Ｆ,121.545224512519,25.025196137009
林繼國診所,臺北市大安區忠孝東路三段２１７巷１弄１２號１樓,121.53911004262,25.042406924537
馬大勳婦產科診所,臺北市大安區安和路一段１１號２樓－１,121.549839954453,25.039668284694
頂好林耳鼻喉科診所,臺北市大安區敦化南路一段１６０巷５０號,121.546900708208,25.043489310145
黃禎憲皮膚科診所,臺北市大安區師大路７1號2樓及７7號,121.528590334133,25.023680939465
非凡整形外科診所,臺北市大安區忠孝東路四段一六二號三樓,121.550289132878,25.041284685749
大學眼科診所,臺北市大安區新生南路3段54之3號、54巷2號2樓、54巷2號2樓之1,121.533818526482,25.020783385171
陳建銓耳鼻喉科診所,臺北市大安區樂利路９３號１Ｆ,121.552278202382,25.025506691999
張尚哲婦產科診所,臺北市大安區忠孝東路四段２１０號４Ｆ,121.552492777988,25.041234247594
李翔耳鼻喉科診所,臺北市大安區和平東路2段18之8號2Ｆ,121.536097978066,25.025643404869
霍天年整形外科診所,臺北市大安區忠孝東路四段一九一號六樓之一,121.551165578659,25.041687077016
